id,userName,userUrl,version,score,title,text,url,updated,appiD
11667911770,Gianfrancescog,https://itunes.apple.com/it/reviews/id1370911619,2.10.61,1,Attenzione si rubano i soldi e non te li restituiscono,"Mi hanno sottratto 20 euro nonostante dall’app store avessi cancellato l’abbonamento. 

Fate molta attenzione perché hanno modi subdoli per farti partire abbonamenti da 10 euro a settimana e non te ne accorgi. 

Ho sentito l’assistenza e non mi hanno voluto restituire niente.",https://itunes.apple.com/it/review?id=1470373330&type=Purple%20Software,2024-08-29T18:20:33-07:00,1470373330
8600455939,SaschaBerg,https://itunes.apple.com/it/reviews/id365691922,2.5.0,1,Non mi convince.,"Avere la disponibilità di provare una versione prova che non consente il libero accesso a tutti i livelli di modifica foto, che prova è? Considerando che la versione base di prova non soddisfa i risultati promessi, eliminerò l’app.",https://itunes.apple.com/it/review?id=1470373330&type=Purple%20Software,2022-04-24T00:24:15-07:00,1470373330
11751933549,igor.milani,https://itunes.apple.com/it/reviews/id508427434,2.10.67,1,genera sempre la stessa cosa,"nonostante abbia cambiato il set di foto da dargli come sorgente genera sempre lo stesso risultato. anche rimuovendole dal telefono e galleria fotografica, quindi le storicizzano e usano sempre quelle salvate sui loro server. pessimo oltre che una grave violazione delle policy di privacy. abbonamento disdetto",https://itunes.apple.com/it/review?id=1470373330&type=Purple%20Software,2024-09-22T05:06:52-07:00,1470373330
8323093819,silver46,https://itunes.apple.com/it/reviews/id47714005,1.7.5,1,Acquistata ma funziona,"Non capisco, ho fatto l'acquisto ma quando la apro risulto essere un utente anonimus con a disposizione solo 5 immagini. Ho provato a disinstallare e re installare ma niente da fare. Ho buttato 10€ al vento. Pazienza",https://itunes.apple.com/it/review?id=1470373330&type=Purple%20Software,2022-02-05T14:03:17-07:00,1470373330
10490615050,Eyas67,https://itunes.apple.com/it/reviews/id337406942,2.9.86,1,Nuova e bella,Un sistema ottimo per riparare foto   Migliore anche di quelli professionali,https://itunes.apple.com/it/review?id=1470373330&type=Purple%20Software,2023-10-18T21:22:46-07:00,1470373330
10470310877,Moni Obsidiana,https://itunes.apple.com/it/reviews/id1365672366,2.9.77,1,E da migliorare,Da migliorare,https://itunes.apple.com/it/review?id=1470373330&type=Purple%20Software,2023-10-13T10:31:04-07:00,1470373330
10531800195,FrancisGGGG12,https://itunes.apple.com/it/reviews/id114272549,2.9.89,1,Non riconosce le figure,"Pessimo funzionamento. 
Non riconosce i visi, i ritocchi sono insignificanti, meglio il correttore del cellulare",https://itunes.apple.com/it/review?id=1470373330&type=Purple%20Software,2023-10-30T07:44:18-07:00,1470373330
10498369377,Ilaria.s0714,https://itunes.apple.com/it/reviews/id1582575015,2.9.86,1,Solo 5 foto,"Mi ha consentito di creare solo 5 foto con IA, dopo bisogna pagare per continuare a utilizzare l’app, anche aspettando il giorno dopo",https://itunes.apple.com/it/review?id=1470373330&type=Purple%20Software,2023-10-21T00:44:09-07:00,1470373330
10455964861,hooperboy_0,https://itunes.apple.com/it/reviews/id1545706258,2.9.83,1,Lenta,"Applicazione lenta, viene scritto un tempo da aspettare e poi ci mette il doppio. Dopo le prime volte non si apre più sullo smartphone…",https://itunes.apple.com/it/review?id=1470373330&type=Purple%20Software,2023-10-09T07:46:54-07:00,1470373330
10755536925,RafRaf75,https://itunes.apple.com/it/reviews/id139906024,2.9.107,1,Non rimuove nemmeno le imperfezioni,"Ho comprato quest’app pagandola 80€ l’anno ma non serve praticamente a nulla, non rimuove nemmeno i brufoli dal viso!",https://itunes.apple.com/it/review?id=1470373330&type=Purple%20Software,2023-12-28T09:28:51-07:00,1470373330
10469477633,tiziosenzaunnome,https://itunes.apple.com/it/reviews/id1316218145,2.9.80,1,belo,bello,https://itunes.apple.com/it/review?id=1470373330&type=Purple%20Software,2023-10-13T06:31:08-07:00,1470373330
10205439152,hi girl so 008786,https://itunes.apple.com/it/reviews/id1218964439,2.9.64,1,FA SCHHIFO,può essere bella e funzionare quanto vuole non lo saprò mai perchè tanto è TUTTO  a pagamento quindi è solo una fregatura se non volete spendere soldi inutili per vedere come sei ingravidata o robe inutili simili ciao,https://itunes.apple.com/it/review?id=1470373330&type=Purple%20Software,2023-07-31T18:20:17-07:00,1470373330
11688694010,occa.me,https://itunes.apple.com/it/reviews/id264563327,2.10.62,1,Unclear,Unclear and unfair. I purchased a week access and it stopped working after a few pictures. If there’s a minimum number of images they should be declaring it,https://itunes.apple.com/it/review?id=1470373330&type=Purple%20Software,2024-09-04T10:30:22-07:00,1470373330
10498914116,niclas29🤩,https://itunes.apple.com/it/reviews/id1428089050,2.9.86,1,Non si puó usare perché c’è troppa pubblicità,Non mi piace,https://itunes.apple.com/it/review?id=1470373330&type=Purple%20Software,2023-10-21T04:14:29-07:00,1470373330
10469229382,Nigritt1980,https://itunes.apple.com/it/reviews/id111954160,2.9.84,3,Pagare pagare pagare,"Ottima app, peccato che bisogna sempre pagare",https://itunes.apple.com/it/review?id=1470373330&type=Purple%20Software,2023-10-13T05:18:46-07:00,1470373330
10351099261,Lecter62,https://itunes.apple.com/it/reviews/id152092285,2.9.74,3,Too much unreal…,I feel like the images are unreal. It would be nice to be able to regulate the editing and to intervene only in localized areas.,https://itunes.apple.com/it/review?id=1470373330&type=Purple%20Software,2023-09-09T10:11:11-07:00,1470373330
10467208352,Ssaryy,https://itunes.apple.com/it/reviews/id324365665,2.9.84,3,TROPPA PUBBLICITÀ,"Insopportabile, va bene metterne un po’ perché non voglio pagare la versione premium, ma cosi no.",https://itunes.apple.com/it/review?id=1470373330&type=Purple%20Software,2023-10-12T14:19:31-07:00,1470373330
9531979756,gahahaahahah,https://itunes.apple.com/it/reviews/id1012329416,2.9.4,3,Logo,"È un app eccezionale ci mancherebbe è sempre stata utilissima, ma il logo non è per niente buono, se la potreste eliminare perfavore",https://itunes.apple.com/it/review?id=1470373330&type=Purple%20Software,2023-01-21T08:54:27-07:00,1470373330
9616833295,luca.cabiati,https://itunes.apple.com/it/reviews/id221961089,2.9.11,3,"Straordinaria, però ….","Funziona in modo magistrale, però è veramente troppo cara.
Il prezzo è del tutto irragionevole",https://itunes.apple.com/it/review?id=1470373330&type=Purple%20Software,2023-02-14T05:34:21-07:00,1470373330
10493017474,Hendrinks,https://itunes.apple.com/it/reviews/id446535945,2.9.86,4,Divertente,Davvero interessante e sviluppata in modo molto intuitivo. Non c’è davvero limite al Ai,https://itunes.apple.com/it/review?id=1470373330&type=Purple%20Software,2023-10-19T12:22:29-07:00,1470373330
10497016615,Sara-iPhone,https://itunes.apple.com/it/reviews/id217920732,2.9.86,4,Otttima,Costa un po’.. però è ottima,https://itunes.apple.com/it/review?id=1470373330&type=Purple%20Software,2023-10-20T14:50:45-07:00,1470373330
10493287026,LL73,https://itunes.apple.com/it/reviews/id136411836,2.9.86,4,Sorprendente,"Usato per migliorare una vecchia foto di famiglia degli anni 40, sorprendente il risultato",https://itunes.apple.com/it/review?id=1470373330&type=Purple%20Software,2023-10-19T14:09:41-07:00,1470373330
10477119452,Stiky91,https://itunes.apple.com/it/reviews/id640499124,2.9.84,4,Fantastica,App perfetta .. unica pecca un po’ costosa a mio parere,https://itunes.apple.com/it/review?id=1470373330&type=Purple%20Software,2023-10-15T04:10:28-07:00,1470373330
10474006986,Micaela.top,https://itunes.apple.com/it/reviews/id1573169908,2.9.84,4,Top,Top,https://itunes.apple.com/it/review?id=1470373330&type=Purple%20Software,2023-10-14T08:42:59-07:00,1470373330
10473634229,hdjjwjkfgkl,https://itunes.apple.com/it/reviews/id472731247,2.9.80,4,Belle application 🎊,❤️,https://itunes.apple.com/it/review?id=1470373330&type=Purple%20Software,2023-10-14T07:04:20-07:00,1470373330
10471725065,Mimir6,https://itunes.apple.com/it/reviews/id1361894609,2.9.84,4,✌🏻,Top,https://itunes.apple.com/it/review?id=1470373330&type=Purple%20Software,2023-10-13T19:29:58-07:00,1470373330
10465716671,DanteDmc87,https://itunes.apple.com/it/reviews/id176529981,2.9.83,4,Ottima app,Bellissima app che si può utilizzare anche con la sola versione free,https://itunes.apple.com/it/review?id=1470373330&type=Purple%20Software,2023-10-12T05:21:00-07:00,1470373330
10504091495,NormApp,https://itunes.apple.com/it/reviews/id435039995,2.9.86,4,Bella bella..,"Ragazzi, basta con questi abbonamenti. Ma chi li spende 5 euro alla settimana per una app, per quanto fantastica possa essere? Fareste più entrare se la metteste a pagamento una tantum. Dai, siate realisti. Detto questo, comunque, complimenti. Ottima app. Ma 5 euro a settimana manco se mi fa il caffè al mattino appena sveglio. Su..",https://itunes.apple.com/it/review?id=1470373330&type=Purple%20Software,2023-10-22T10:30:23-07:00,1470373330
10534505828,thor_breaker,https://itunes.apple.com/it/reviews/id366674327,2.9.89,4,App fantastica,Sono veramente soddisfatto di come quest’app renda le foto pazzesche,https://itunes.apple.com/it/review?id=1470373330&type=Purple%20Software,2023-10-31T03:35:09-07:00,1470373330
10463132041,andresv427,https://itunes.apple.com/it/reviews/id831359073,2.9.83,4,Top,Top,https://itunes.apple.com/it/review?id=1470373330&type=Purple%20Software,2023-10-11T09:39:40-07:00,1470373330
6745174595,kaozapple,https://itunes.apple.com/it/reviews/id11549028,1.3.10,4,Amazing!,Really impressive app!,https://itunes.apple.com/it/review?id=1470373330&type=Purple%20Software,2020-12-12T06:13:45-07:00,1470373330
10514711268,Alkimista97,https://itunes.apple.com/it/reviews/id1554794100,2.9.88,4,Easy,Easy to use and perfect for quick editing. Suggested,https://itunes.apple.com/it/review?id=1470373330&type=Purple%20Software,2023-10-25T11:18:33-07:00,1470373330
10905826645,Dariozzz,https://itunes.apple.com/it/reviews/id170851468,2.9.119,4,Ottima,Va bene… anche se (chiaramente) la versione free ti costringe a tanta pubblicità…,https://itunes.apple.com/it/review?id=1470373330&type=Purple%20Software,2024-02-05T12:20:35-07:00,1470373330
11732913831,limotravel,https://itunes.apple.com/it/reviews/id140905582,2.10.65,5,Grazie,Grazie per aver dato vita ad una vecchia foto di mia madre❤️,https://itunes.apple.com/it/review?id=1470373330&type=Purple%20Software,2024-09-16T23:17:54-07:00,1470373330
10475554251,Marco Vittorino,https://itunes.apple.com/it/reviews/id1045389798,2.9.84,5,Stupendo!,amo bending spoons,https://itunes.apple.com/it/review?id=1470373330&type=Purple%20Software,2023-10-14T17:40:35-07:00,1470373330
10476582585,Hdndbxbdbd,https://itunes.apple.com/it/reviews/id1580475893,2.9.84,5,Loved it,Loved it,https://itunes.apple.com/it/review?id=1470373330&type=Purple%20Software,2023-10-15T00:47:34-07:00,1470373330
9477155584,Angelo1961sat,https://itunes.apple.com/it/reviews/id223979760,2.8.7,5,Facile,Ottimo prodotto,https://itunes.apple.com/it/review?id=1470373330&type=Purple%20Software,2023-01-06T02:32:42-07:00,1470373330
10477130896,Denise710,https://itunes.apple.com/it/reviews/id144633819,2.9.84,5,Top,Fantastica,https://itunes.apple.com/it/review?id=1470373330&type=Purple%20Software,2023-10-15T04:14:23-07:00,1470373330
10477241334,Waliò,https://itunes.apple.com/it/reviews/id290201761,2.9.84,5,Pazzesca,Davvero ben fatta,https://itunes.apple.com/it/review?id=1470373330&type=Purple%20Software,2023-10-15T04:50:47-07:00,1470373330
10477947610,Kry87_,https://itunes.apple.com/it/reviews/id338433153,2.9.84,5,Ciao,Non trovo la funzione back 90 ;/ Dove sei trova ?,https://itunes.apple.com/it/review?id=1470373330&type=Purple%20Software,2023-10-15T08:12:07-07:00,1470373330
10481971633,hugiug,https://itunes.apple.com/it/reviews/id1580985507,2.9.85,5,fufuufif,nnnnbcopcjcoh,https://itunes.apple.com/it/review?id=1470373330&type=Purple%20Software,2023-10-16T09:56:02-07:00,1470373330
10481978014,lecini elisa,https://itunes.apple.com/it/reviews/id1291326365,2.9.85,5,Top mi piace tanto peccato che e con pagamento,❤️👍🏻,https://itunes.apple.com/it/review?id=1470373330&type=Purple%20Software,2023-10-16T09:58:12-07:00,1470373330
10483232417,ladea91,https://itunes.apple.com/it/reviews/id971665190,2.9.85,5,🔝🤩,Che bello,https://itunes.apple.com/it/review?id=1470373330&type=Purple%20Software,2023-10-16T18:33:31-07:00,1470373330
10484607072,Willy57,https://itunes.apple.com/it/reviews/id42226810,2.9.85,5,Ottimo,"Rapido e veloce, provato nella funzione base, miglioramento delle foto garantito",https://itunes.apple.com/it/review?id=1470373330&type=Purple%20Software,2023-10-17T04:59:57-07:00,1470373330
10484749223,anna.tomasicchio,https://itunes.apple.com/it/reviews/id1581243607,2.9.85,5,bellissima davvero,utile e bella,https://itunes.apple.com/it/review?id=1470373330&type=Purple%20Software,2023-10-17T05:47:08-07:00,1470373330
10481350697,Lucia 7000,https://itunes.apple.com/it/reviews/id1251847350,2.9.85,5,Consiglio!!,Molto bella,https://itunes.apple.com/it/review?id=1470373330&type=Purple%20Software,2023-10-16T06:43:10-07:00,1470373330
10472447000,Islanejaoaneb,https://itunes.apple.com/it/reviews/id1580101516,2.9.84,5,Top,Top,https://itunes.apple.com/it/review?id=1470373330&type=Purple%20Software,2023-10-14T00:33:17-07:00,1470373330
10743071276,Th1ago33,https://itunes.apple.com/it/reviews/id417375816,2.9.107,5,App davvero fantastica,Speriamo non sia a pagamento 🤣😅,https://itunes.apple.com/it/review?id=1470373330&type=Purple%20Software,2023-12-25T05:45:09-07:00,1470373330
6582372040,eri_fra98,https://itunes.apple.com/it/reviews/id528196458,1.3.9,5,Wowwwwww,A super app that allows you to improve the quality of your photos!!,https://itunes.apple.com/it/review?id=1470373330&type=Purple%20Software,2020-10-28T02:56:43-07:00,1470373330
10471249830,Jernest77,https://itunes.apple.com/it/reviews/id1431945682,2.9.84,5,increíble,Super genial,https://itunes.apple.com/it/review?id=1470373330&type=Purple%20Software,2023-10-13T16:21:03-07:00,1470373330
10470985463,Peppeold,https://itunes.apple.com/it/reviews/id240680326,2.9.82,5,Bellissimo,Bellissimo,https://itunes.apple.com/it/review?id=1470373330&type=Purple%20Software,2023-10-13T14:33:52-07:00,1470373330
10971308659,JumpinJack92,https://itunes.apple.com/it/reviews/id186317060,2.10.2,5,Potentissima,"Davvero utile e performante, ottimi risultati",https://itunes.apple.com/it/review?id=1470373330&type=Purple%20Software,2024-02-23T08:40:01-07:00,1470373330
10469688272,bonovox1771,https://itunes.apple.com/it/reviews/id1334228140,2.9.84,5,Fabuleux,J’ai été agréablement surpris,https://itunes.apple.com/it/review?id=1470373330&type=Purple%20Software,2023-10-13T07:29:03-07:00,1470373330
11155627628,Matubbir,https://itunes.apple.com/it/reviews/id1236764271,2.10.20,5,Best Editing app for me,Awesome i like so much you guys are trying this app,https://itunes.apple.com/it/review?id=1470373330&type=Purple%20Software,2024-04-13T19:09:43-07:00,1470373330
10469245946,Naomi🩷🩵🩶,https://itunes.apple.com/it/reviews/id1579819163,2.9.83,5,Stupenda,"Quest app è stupenda installatala subito e magnifica che aggiusta tutte le foto brutte in bella
🩷🩵🤍❤️💙🤎🧡💜💛🖤💚🩶",https://itunes.apple.com/it/review?id=1470373330&type=Purple%20Software,2023-10-13T05:23:46-07:00,1470373330
11362952892,Sebastian Scarso Pagano,https://itunes.apple.com/it/reviews/id1290394066,2.10.36,5,Fantastica,L’unica app che a differenza delle altre funziona BENE! Complimenti,https://itunes.apple.com/it/review?id=1470373330&type=Purple%20Software,2024-06-09T14:59:19-07:00,1470373330
10468887112,kristeta26,https://itunes.apple.com/it/reviews/id1433029446,2.9.80,5,It’s super fun using remini,I love using this app❤️so entertaining,https://itunes.apple.com/it/review?id=1470373330&type=Purple%20Software,2023-10-13T03:24:20-07:00,1470373330
10467410864,Arlucit,https://itunes.apple.com/it/reviews/id100863167,2.9.81,5,Peccato sia quasi tutto a pagamento,Ottima applicazione,https://itunes.apple.com/it/review?id=1470373330&type=Purple%20Software,2023-10-12T15:57:07-07:00,1470373330
9686377778,nin te ciao,https://itunes.apple.com/it/reviews/id1486743157,2.9.18,5,Perfetto,Mi è servito e mi è piaciuto molto bellissimo e complimenti 𝓧,https://itunes.apple.com/it/review?id=1470373330&type=Purple%20Software,2023-03-06T12:28:03-07:00,1470373330
10467106147,Eryyyyyy,https://itunes.apple.com/it/reviews/id176923768,2.9.84,5,Fantastico,App fantastica per quel che costa fa troppo beneb tutto,https://itunes.apple.com/it/review?id=1470373330&type=Purple%20Software,2023-10-12T13:33:03-07:00,1470373330
10466315787,Betani.,https://itunes.apple.com/it/reviews/id313916382,2.9.84,5,Fantastic,Ottimo,https://itunes.apple.com/it/review?id=1470373330&type=Purple%20Software,2023-10-12T08:30:54-07:00,1470373330
10465899200,GinnyGenio,https://itunes.apple.com/it/reviews/id1435571927,2.9.84,5,Bellissima,"È molto bella e funziona anche gratuitamente ci sono cose a pagamento, ma comunque molto bella",https://itunes.apple.com/it/review?id=1470373330&type=Purple%20Software,2023-10-12T06:19:44-07:00,1470373330
10486117461,L6I,https://itunes.apple.com/it/reviews/id1324211020,2.9.85,5,Fantastico,Ho migliorato tante foto sfocate grazie,https://itunes.apple.com/it/review?id=1470373330&type=Purple%20Software,2023-10-17T14:08:31-07:00,1470373330
10486546545,Dinosauro86,https://itunes.apple.com/it/reviews/id1581410513,2.9.85,5,Good,Funziona,https://itunes.apple.com/it/review?id=1470373330&type=Purple%20Software,2023-10-17T17:28:03-07:00,1470373330
10489264330,Sepehr899,https://itunes.apple.com/it/reviews/id1581694108,2.9.86,5,F,Good,https://itunes.apple.com/it/review?id=1470373330&type=Purple%20Software,2023-10-18T11:23:10-07:00,1470373330
10489529347,Alexfabiani,https://itunes.apple.com/it/reviews/id1320362780,2.9.85,5,Eccellente,Incredibile come possa migliorare il volto,https://itunes.apple.com/it/review?id=1470373330&type=Purple%20Software,2023-10-18T13:03:50-07:00,1470373330
10543067990,mgengineering,https://itunes.apple.com/it/reviews/id268702701,2.9.89,5,Modifica i ricordi,Software strepitoso!,https://itunes.apple.com/it/review?id=1470373330&type=Purple%20Software,2023-11-02T13:03:03-07:00,1470373330
11252841483,elena veroi,https://itunes.apple.com/it/reviews/id516785763,2.10.28,5,Senza trucco,Puoi farti qualsiasi foto senza trucco e… in un attimo: voilà!  il trucco è fatto,https://itunes.apple.com/it/review?id=1470373330&type=Purple%20Software,2024-05-10T09:56:54-07:00,1470373330
10440753439,jackyisplayer,https://itunes.apple.com/it/reviews/id1194688210,2.9.82,5,App stupenda,Ormai siamo nel futuro,https://itunes.apple.com/it/review?id=1470373330&type=Purple%20Software,2023-10-05T02:23:29-07:00,1470373330
8645368675,bshs sksk,https://itunes.apple.com/it/reviews/id1318533307,2.6.0,5,manu,app molto utile grazie,https://itunes.apple.com/it/review?id=1470373330&type=Purple%20Software,2022-05-06T23:24:35-07:00,1470373330
11253890974,La clod,https://itunes.apple.com/it/reviews/id292495833,2.10.28,5,LA MIGLIORE APP,super top. Non aggiungo altro perché non serve ! Da avere assolutamente 🫶🏻,https://itunes.apple.com/it/review?id=1470373330&type=Purple%20Software,2024-05-10T17:23:19-07:00,1470373330
10667894387,Ror4501,https://itunes.apple.com/it/reviews/id128596838,2.9.103,5,Perfetta,Bellissima! Ci sono rimasto a bocca aperta,https://itunes.apple.com/it/review?id=1470373330&type=Purple%20Software,2023-12-07T12:02:36-07:00,1470373330
10345786055,Ciro Milucci,https://itunes.apple.com/it/reviews/id1424177543,2.9.72,5,Eccellente,Entusiasmante,https://itunes.apple.com/it/review?id=1470373330&type=Purple%20Software,2023-09-07T23:25:07-07:00,1470373330
9876762683,Gr3gori8,https://itunes.apple.com/it/reviews/id1455383907,2.9.33,5,Wow,L’app mi ha salvato la vita in molti casi. Pazzesca,https://itunes.apple.com/it/review?id=1470373330&type=Purple%20Software,2023-04-30T01:51:44-07:00,1470373330
10569669083,Fremì,https://itunes.apple.com/it/reviews/id1338544242,2.9.92,5,Fantastica,Però è lentissima,https://itunes.apple.com/it/review?id=1470373330&type=Purple%20Software,2023-11-10T01:03:30-07:00,1470373330
10807319107,Paulbb.,https://itunes.apple.com/it/reviews/id1612205425,2.9.112,5,Belle foto,Ottima,https://itunes.apple.com/it/review?id=1470373330&type=Purple%20Software,2024-01-10T13:03:54-07:00,1470373330
10444120972,Mamisoa A.,https://itunes.apple.com/it/reviews/id313980299,2.9.82,5,Bellissimo lo adoro,Quello che pensò già nel titolo,https://itunes.apple.com/it/review?id=1470373330&type=Purple%20Software,2023-10-06T00:14:25-07:00,1470373330
10518015953,P.f.66,https://itunes.apple.com/it/reviews/id140460732,2.9.88,5,Eccezionale,Ottima app che utilizza l’Ai perfetto,https://itunes.apple.com/it/review?id=1470373330&type=Purple%20Software,2023-10-26T10:19:36-07:00,1470373330
10634132736,fortuna deluca,https://itunes.apple.com/it/reviews/id1519158684,2.9.100,5,Foto,App utile corregge le piccole imperfezioni!!!,https://itunes.apple.com/it/review?id=1470373330&type=Purple%20Software,2023-11-28T01:34:23-07:00,1470373330
10918565803,Krundo,https://itunes.apple.com/it/reviews/id247788079,2.9.121,5,Top,"App intuitiva e fa tutto alla grande, soddisfatto dei risultati",https://itunes.apple.com/it/review?id=1470373330&type=Purple%20Software,2024-02-08T22:48:24-07:00,1470373330
10446469373,dianagallardo,https://itunes.apple.com/it/reviews/id164461383,2.9.77,5,La svolta!,Questa app è semplicemente stupendaaaaaaaaa,https://itunes.apple.com/it/review?id=1470373330&type=Purple%20Software,2023-10-06T14:46:04-07:00,1470373330
10952381146,Caty9876,https://itunes.apple.com/it/reviews/id406470948,2.9.125,5,Ottima,I migliori 9 euro spesi della mia vita!!!,https://itunes.apple.com/it/review?id=1470373330&type=Purple%20Software,2024-02-18T04:39:09-07:00,1470373330
10463270317,Jey9005,https://itunes.apple.com/it/reviews/id1537869970,2.9.83,5,Ottima app stupenda,"Ottima app stupenda, ottimo per creare Photo",https://itunes.apple.com/it/review?id=1470373330&type=Purple%20Software,2023-10-11T10:30:42-07:00,1470373330
8202668141,Firebirdo,https://itunes.apple.com/it/reviews/id26156644,1.7.5,5,What’s up in 2022?,Nothing work. My account. My purchase. Nothing!!!,https://itunes.apple.com/it/review?id=1470373330&type=Purple%20Software,2022-01-04T01:45:16-07:00,1470373330
10491290721,stulist,https://itunes.apple.com/it/reviews/id569241020,2.9.86,5,Ottimo,Bellissimo ✨,https://itunes.apple.com/it/review?id=1470373330&type=Purple%20Software,2023-10-19T02:47:06-07:00,1470373330
10404744867,biaginir,https://itunes.apple.com/it/reviews/id975783385,2.9.78,5,Foto ritoccata,Bellissima e utilissima,https://itunes.apple.com/it/review?id=1470373330&type=Purple%20Software,2023-09-24T23:37:58-07:00,1470373330
11752496817,😀😝,https://itunes.apple.com/it/reviews/id279956802,2.10.59,5,Top,Il meglio che ho provato sino ad ora. Facilissima da usare,https://itunes.apple.com/it/review?id=1470373330&type=Purple%20Software,2024-09-22T07:59:34-07:00,1470373330
11081046773,Molina4Ever,https://itunes.apple.com/it/reviews/id188038490,2.10.11,5,The best!,Makes my pics look so sharp 😍,https://itunes.apple.com/it/review?id=1470373330&type=Purple%20Software,2024-03-24T10:18:35-07:00,1470373330
10497204503,gabri-shen,https://itunes.apple.com/it/reviews/id81015412,2.9.86,5,È in assoluto la migliore,C’è poco da dire la qualità di questa app è assolutamente stratosferica,https://itunes.apple.com/it/review?id=1470373330&type=Purple%20Software,2023-10-20T16:11:53-07:00,1470373330
7780416571,hysaj_alessio,https://itunes.apple.com/it/reviews/id1233166377,1.6.2,5,Sorpreso,Qualità app top,https://itunes.apple.com/it/review?id=1470373330&type=Purple%20Software,2021-09-07T03:36:08-07:00,1470373330
10675934958,55rabab,https://itunes.apple.com/it/reviews/id1599693262,2.9.103,5,h,bella sé non fosse a pagamento,https://itunes.apple.com/it/review?id=1470373330&type=Purple%20Software,2023-12-09T13:40:03-07:00,1470373330
10499654846,e.corobuta79,https://itunes.apple.com/it/reviews/id1292853237,2.9.86,5,Elena,Bellissimo e fantastico perfetto,https://itunes.apple.com/it/review?id=1470373330&type=Purple%20Software,2023-10-21T07:51:03-07:00,1470373330
10500524699,camilla.durzo,https://itunes.apple.com/it/reviews/id1366460034,2.9.86,5,davvero bellissimo!,top,https://itunes.apple.com/it/review?id=1470373330&type=Purple%20Software,2023-10-21T12:09:01-07:00,1470373330
10501935294,gahshhshhs,https://itunes.apple.com/it/reviews/id674510930,2.9.86,5,Stupenda!,Stupenda app! Vale tutti i soldi che chiedono,https://itunes.apple.com/it/review?id=1470373330&type=Purple%20Software,2023-10-21T21:39:44-07:00,1470373330
10502853018,Elibetty82,https://itunes.apple.com/it/reviews/id1132027152,2.9.86,5,Bello,Fatto bene!,https://itunes.apple.com/it/review?id=1470373330&type=Purple%20Software,2023-10-22T04:00:35-07:00,1470373330
10503394097,Jamilaouariti,https://itunes.apple.com/it/reviews/id1539636617,2.9.86,5,😍,É una bellissima app 😍,https://itunes.apple.com/it/review?id=1470373330&type=Purple%20Software,2023-10-22T06:58:03-07:00,1470373330
10433851796,Scratmonamour,https://itunes.apple.com/it/reviews/id254807789,2.9.80,5,Eccellente,"Ottima applicazione, molto utile e semplice da usare.",https://itunes.apple.com/it/review?id=1470373330&type=Purple%20Software,2023-10-03T05:08:04-07:00,1470373330
10538318699,jimmy.ferazzi,https://itunes.apple.com/it/reviews/id243299906,2.9.89,5,Fantastico,"Veramente fantastico , facile da usare",https://itunes.apple.com/it/review?id=1470373330&type=Purple%20Software,2023-11-01T05:53:50-07:00,1470373330
